{
  "schema_version": "investor_run_config/1",
  "bench_id": "investors-v0",
  "status": "draft",
  "today": "2026-10-07",
  "search": { "provider": "searxng", "results_per_query": 10 },
  "agent_model": { "family": "TO-APPROVE", "model_id": "TO-APPROVE" },
  "preannotator_model": { "family": "TO-APPROVE-DIFFERENT-FAMILY", "model_id": "TO-APPROVE" },
  "budgets": { "searches": 18, "fetches": 54, "planner_calls": 8, "tokens_nominal": 300000, "seconds_nominal": 1800 },
  "patience_n": 5,
  "default_fetch_per_search": 3,
  "b2": { "initial_batch": 6, "max_searches_per_step": 3 },
  "seeds": [101, 202, 303],
  "prompts": { "b0_templates": "v1", "planner": "v1", "extractor": "v1", "judge": "v1", "preannotator": "v1" },
  "catalog": "criteria_catalog.investor@v1",
  "decision_rule": {
    "status": "proposed",
    "min_recall_gain": 0.05,
    "alpha": 0.05,
    "max_ndcg_drop": 0.03,
    "max_hard_false_positive_rate": 0.1,
    "min_correct_null_abstentions": 2
  }
}
